{
  "asset_id": "aci-01-test",
  "comparison_status": "candidate_selected",
  "evaluations": [
    {
      "candidate_id": "meshy-candidate-01",
      "path": "astrion-3d-pipeline/work/generative-probes/aci-01-test/aci-01-test-probe-20260904-01/diagnostics/meshy/meshy-candidate-01/candidate-evaluation.json",
      "provider": "meshy",
      "sha256": "17996dfdcc4979cdf1a42e425e229cae08539e5e9c0405f341761114cfb683cc"
    },
    {
      "candidate_id": "tripo-candidate-01",
      "path": "astrion-3d-pipeline/work/generative-probes/aci-01-test/aci-01-test-probe-20260904-01/diagnostics/tripo/tripo-candidate-01/candidate-evaluation.json",
      "provider": "tripo",
      "sha256": "6ac94c504466a4c096531fac4cbc7610f5f22e7a465810dd74853bb1e3e1c913"
    }
  ],
  "intended_outcome": "repair",
  "notes": "Reviewed probe closeout only. The selected GLB remains immutable probe evidence. No Master Mesh was promoted and Audit 1 was not run.",
  "probe_id": "aci-01-test-probe-20260904-01",
  "production_handoff": {
    "asset_spec_path": null,
    "evidence_report_path": null,
    "status": "not_requested"
  },
  "rationale": "Both candidates preserve the spherical body, segmented shell, and circular front-core identity from the shared geometria.png reference. Tripo is selected because its armor plates and concentric core are more coherent, it has 10 connected components instead of Meshy's 50, it includes normals, and it has fewer boundary edges. It still requires deliberate repair because it has 13779 triangles, 1586 boundary edges, and 53 non-manifold edges; therefore it is not accepted or normalized directly.",
  "record_type": "probe_decision",
  "reviewed_at": "2026-09-04T21:36:13-06:00",
  "reviewer": "E. Lopez",
  "schema_version": "0.1",
  "selected_candidate_id": "tripo-candidate-01",
  "state": "closed"
}
